{
  "analysisPlanIdentitySha256": "61e0b28d2464b2dcb4fa6da0d3352b9e7e735c82c641fc2618c3e6c479c4009a",
  "cohortIdentitySha256": "f9fec6a4ecf409f42cb41ff1c640f2df150270548846022772c39dbdc3afe212",
  "contentIdentitySha256": "5e386e54423d4eafeb1f823abc974f2ddda371dc547024e454b32b6bcfccb0f9",
  "epochs": [
    "public-anchor-epoch-001"
  ],
  "kind": "genesis/genesisbench-observations-v0.1",
  "observations": [
    {
      "caseId": "completion-large",
      "conditionId": "condition-completion-context-large-001",
      "conditionIdentitySha256": "53c32dbb9ea56a9aee3f507fe553f2efba1d94dc25f5cf127ff00804eb6cd872",
      "epochId": "public-anchor-epoch-001",
      "lineageId": "lineage-completion-001",
      "lineageIdentitySha256": "6e1e39b15000664c02e50c6243e1cffbf6ff368270e914d74d9311501d94fd64",
      "outcome": "solved",
      "qualityScoreBasisPoints": 9200,
      "reasonCodes": [],
      "systemId": "reference-alpha"
    },
    {
      "caseId": "completion-medium",
      "conditionId": "condition-completion-context-medium-001",
      "conditionIdentitySha256": "12b05e96befa8fd9c8408d3d09fc7e7cbca2e65043727b3ead7fc9d0f6e4d2bd",
      "epochId": "public-anchor-epoch-001",
      "lineageId": "lineage-completion-001",
      "lineageIdentitySha256": "6e1e39b15000664c02e50c6243e1cffbf6ff368270e914d74d9311501d94fd64",
      "outcome": "solved",
      "qualityScoreBasisPoints": 9200,
      "reasonCodes": [],
      "systemId": "reference-alpha"
    },
    {
      "caseId": "completion-small",
      "conditionId": "condition-completion-context-small-001",
      "conditionIdentitySha256": "f5b98cc7ae8407d9603d305fa56ca59af2cc609c73804be1357286a67efa2667",
      "epochId": "public-anchor-epoch-001",
      "lineageId": "lineage-completion-001",
      "lineageIdentitySha256": "6e1e39b15000664c02e50c6243e1cffbf6ff368270e914d74d9311501d94fd64",
      "outcome": "solved",
      "qualityScoreBasisPoints": 9200,
      "reasonCodes": [],
      "systemId": "reference-alpha"
    },
    {
      "caseId": "deployment-large",
      "conditionId": "condition-deployment-context-large-001",
      "conditionIdentitySha256": "66a1f4410b7a7f837b992852591ba3d9d0a01a33f68cb08f0fca6641c9cd7ea7",
      "epochId": "public-anchor-epoch-001",
      "lineageId": "lineage-deployment-001",
      "lineageIdentitySha256": "42ad1f5ace80cc77926d1c5a96408b7c4e0eb1041a16dbe5d9eaeee56aa75494",
      "outcome": "solved",
      "qualityScoreBasisPoints": 9163,
      "reasonCodes": [],
      "systemId": "reference-alpha"
    },
    {
      "caseId": "deployment-medium",
      "conditionId": "condition-deployment-context-medium-001",
      "conditionIdentitySha256": "ae371d4a698f834791413ef03c2362bdf55da9651dd3b28f740bdd57390f59ed",
      "epochId": "public-anchor-epoch-001",
      "lineageId": "lineage-deployment-001",
      "lineageIdentitySha256": "42ad1f5ace80cc77926d1c5a96408b7c4e0eb1041a16dbe5d9eaeee56aa75494",
      "outcome": "solved",
      "qualityScoreBasisPoints": 9163,
      "reasonCodes": [],
      "systemId": "reference-alpha"
    },
    {
      "caseId": "deployment-small",
      "conditionId": "condition-deployment-context-small-001",
      "conditionIdentitySha256": "5cc08b005bef65fb6e86c297d3fa31c1d91067110335cbd97dff67b75641a9c3",
      "epochId": "public-anchor-epoch-001",
      "lineageId": "lineage-deployment-001",
      "lineageIdentitySha256": "42ad1f5ace80cc77926d1c5a96408b7c4e0eb1041a16dbe5d9eaeee56aa75494",
      "outcome": "solved",
      "qualityScoreBasisPoints": 9163,
      "reasonCodes": [],
      "systemId": "reference-alpha"
    },
    {
      "caseId": "generation-large",
      "conditionId": "condition-generation-context-large-001",
      "conditionIdentitySha256": "f5bb4c53473bebbe22f384a6833a4bec1dd19927ef5dd480fdd6403ebcaad499",
      "epochId": "public-anchor-epoch-001",
      "lineageId": "lineage-generation-001",
      "lineageIdentitySha256": "6867cdd950394cd2a7f0b03872c0f15ce4cbcecd3fc2707592cd2b0adec795ce",
      "outcome": "solved",
      "qualityScoreBasisPoints": 9126,
      "reasonCodes": [],
      "systemId": "reference-alpha"
    },
    {
      "caseId": "generation-medium",
      "conditionId": "condition-generation-context-medium-001",
      "conditionIdentitySha256": "21405f38d36a4478077b29ce7aa07eba203de8d4a7e30f6ae592c83cce2b9146",
      "epochId": "public-anchor-epoch-001",
      "lineageId": "lineage-generation-001",
      "lineageIdentitySha256": "6867cdd950394cd2a7f0b03872c0f15ce4cbcecd3fc2707592cd2b0adec795ce",
      "outcome": "solved",
      "qualityScoreBasisPoints": 9126,
      "reasonCodes": [],
      "systemId": "reference-alpha"
    },
    {
      "caseId": "generation-small",
      "conditionId": "condition-generation-context-small-001",
      "conditionIdentitySha256": "55c2eb6fd341476b3b2f431d47efd993dcdf12da32a4a5e211e16bde6f45673d",
      "epochId": "public-anchor-epoch-001",
      "lineageId": "lineage-generation-001",
      "lineageIdentitySha256": "6867cdd950394cd2a7f0b03872c0f15ce4cbcecd3fc2707592cd2b0adec795ce",
      "outcome": "solved",
      "qualityScoreBasisPoints": 9126,
      "reasonCodes": [],
      "systemId": "reference-alpha"
    },
    {
      "caseId": "package-migration-large",
      "conditionId": "condition-package-migration-context-large-001",
      "conditionIdentitySha256": "bdd41a17205a3fed5bcd754d3c8a13fe76829b0e178c39968d95bebb4b6edc99",
      "epochId": "public-anchor-epoch-001",
      "lineageId": "lineage-package-migration-001",
      "lineageIdentitySha256": "8c7188b3871e5d52f83912faafaa8e9bdaf91cd40cecf6c28e966c7759e65259",
      "outcome": "solved",
      "qualityScoreBasisPoints": 9089,
      "reasonCodes": [],
      "systemId": "reference-alpha"
    },
    {
      "caseId": "package-migration-medium",
      "conditionId": "condition-package-migration-context-medium-001",
      "conditionIdentitySha256": "cd4bf03f0477e375f069006eb120c651b74fcd4a7e675548e8e9f1a69380d236",
      "epochId": "public-anchor-epoch-001",
      "lineageId": "lineage-package-migration-001",
      "lineageIdentitySha256": "8c7188b3871e5d52f83912faafaa8e9bdaf91cd40cecf6c28e966c7759e65259",
      "outcome": "solved",
      "qualityScoreBasisPoints": 9089,
      "reasonCodes": [],
      "systemId": "reference-alpha"
    },
    {
      "caseId": "package-migration-small",
      "conditionId": "condition-package-migration-context-small-001",
      "conditionIdentitySha256": "3234ff94059833a35bb3b0633c1f360f23a1d9c872380e8f2638316e9049bc8f",
      "epochId": "public-anchor-epoch-001",
      "lineageId": "lineage-package-migration-001",
      "lineageIdentitySha256": "8c7188b3871e5d52f83912faafaa8e9bdaf91cd40cecf6c28e966c7759e65259",
      "outcome": "solved",
      "qualityScoreBasisPoints": 9089,
      "reasonCodes": [],
      "systemId": "reference-alpha"
    },
    {
      "caseId": "performance-repair-large",
      "conditionId": "condition-performance-repair-context-large-001",
      "conditionIdentitySha256": "0a8f026bf2eaf4813f3702cb94b2223bf17694493ee1ce0e52da6fb51013238a",
      "epochId": "public-anchor-epoch-001",
      "lineageId": "lineage-performance-repair-001",
      "lineageIdentitySha256": "4af76c67ebca87566e6a91b87747d490c276268ce98d8950b5306b62f0ae488d",
      "outcome": "solved",
      "qualityScoreBasisPoints": 9052,
      "reasonCodes": [],
      "systemId": "reference-alpha"
    },
    {
      "caseId": "performance-repair-medium",
      "conditionId": "condition-performance-repair-context-medium-001",
      "conditionIdentitySha256": "3e1054cd706e68f149ac81f5f7291dd160bc95089371c74ede1cce9462b90e8c",
      "epochId": "public-anchor-epoch-001",
      "lineageId": "lineage-performance-repair-001",
      "lineageIdentitySha256": "4af76c67ebca87566e6a91b87747d490c276268ce98d8950b5306b62f0ae488d",
      "outcome": "solved",
      "qualityScoreBasisPoints": 9052,
      "reasonCodes": [],
      "systemId": "reference-alpha"
    },
    {
      "caseId": "performance-repair-small",
      "conditionId": "condition-performance-repair-context-small-001",
      "conditionIdentitySha256": "45ac673c1d1abbfc916e381d6124d6c8a3547723cbc14540f84d2525439e5872",
      "epochId": "public-anchor-epoch-001",
      "lineageId": "lineage-performance-repair-001",
      "lineageIdentitySha256": "4af76c67ebca87566e6a91b87747d490c276268ce98d8950b5306b62f0ae488d",
      "outcome": "solved",
      "qualityScoreBasisPoints": 9052,
      "reasonCodes": [],
      "systemId": "reference-alpha"
    },
    {
      "caseId": "policy-minimization-large",
      "conditionId": "condition-policy-minimization-context-large-001",
      "conditionIdentitySha256": "98dbfe3e79ea044f7f61b6fbe6b5dc99cfcafadcfc1a7b69737eb3b21de7eef8",
      "epochId": "public-anchor-epoch-001",
      "lineageId": "lineage-policy-minimization-001",
      "lineageIdentitySha256": "ffc97f1cfa14bc67dbbdd4e0ea498be056fdff59bbff53b031f28e65140c3c60",
      "outcome": "solved",
      "qualityScoreBasisPoints": 9015,
      "reasonCodes": [],
      "systemId": "reference-alpha"
    },
    {
      "caseId": "policy-minimization-medium",
      "conditionId": "condition-policy-minimization-context-medium-001",
      "conditionIdentitySha256": "e54e0cecfe86252d4da784a64310069ab9e474625c2ee2cc440c4e9ae64bc9c3",
      "epochId": "public-anchor-epoch-001",
      "lineageId": "lineage-policy-minimization-001",
      "lineageIdentitySha256": "ffc97f1cfa14bc67dbbdd4e0ea498be056fdff59bbff53b031f28e65140c3c60",
      "outcome": "solved",
      "qualityScoreBasisPoints": 9015,
      "reasonCodes": [],
      "systemId": "reference-alpha"
    },
    {
      "caseId": "policy-minimization-small",
      "conditionId": "condition-policy-minimization-context-small-001",
      "conditionIdentitySha256": "543c8b984679db2660db66358bc2cd30b27f8a80d18999c2d3e1b13a31534ad3",
      "epochId": "public-anchor-epoch-001",
      "lineageId": "lineage-policy-minimization-001",